Sentence,Response
Quali sono i passaggi per annotare i sintomi che sto sperimentando oggi?,"È una buona idea tenere un diario dei sintomi. Annota l'ora in cui i sintomi si manifestano, la loro durata e l'intensità su una scala da 1 a 10."
Qual è il metodo migliore per annotare i sintomi che sto avendo oggi?,"Ti consiglio di tenere un diario dettagliato in cui annoti l'ora, il tipo di sintomo, la sua intensità e qualsiasi possibile fattore scatenante, come l'alimentazione o l'attività fisica, per fornire al tuo medico un quadro preciso della tua situazione di salute."
Qual è il metodo migliore per annotare i sintomi che ho avuto oggi?,"Ti consiglio di tenere un diario quotidiano dove annotare l'ora e il tipo di sintomi che hai sperimentato, insieme a eventuali fattori scatenanti o attività svolte, per aiutare il medico a capire meglio la tua condizione."
Puoi suggerirmi un modo per annotare i sintomi che ho avuto oggi?,"Certo, ti consiglio di tenere un diario dei sintomi dove puoi annotare l'ora, la descrizione dettagliata di ciascun sintomo, la loro durata e qualsiasi fattore scatenante che potresti aver notato."
Qual è il modo migliore per annotare i sintomi che avverto oggi?,"Annotare i sintomi in modo dettagliato può essere molto utile per il tuo medico. Ti consiglio di creare un diario giornaliero dove registrare l'orario in cui si presentano i sintomi, la loro durata, l'intensità e qualsiasi fattore scatenante o alleviante che hai notato."
Come la razza può influenzare l'ipertensione?,"La razza può influenzare l'ipertensione in vari modi, poiché alcuni gruppi etnici possono avere una predisposizione genetica che rende più probabile lo sviluppo di questa condizione."
In che modo la razza può avere un impatto sull'ipertensione?,"La razza può influenzare l'ipertensione poiché alcune popolazioni, come gli afroamericani, tendono ad avere una maggiore predisposizione genetica a sviluppare la condizione."
In che modo l'etnia può avere un impatto sull'ipertensione?,Alcuni gruppi etnici possono essere geneticamente predisposti a sviluppare l'ipertensione e possono anche rispondere in modo diverso a determinati trattamenti.
In che modo l'appartenenza etnica può avere un impatto sull'ipertensione?,"L'appartenenza etnica può influenzare l'ipertensione a causa di vari fattori genetici, ambientali e socioeconomici che variano tra le diverse popolazioni. Alcuni gruppi etnici possono avere una predisposizione genetica all'ipertensione, mentre altri potrebbero essere più suscettibili a causa di fattori ambientali come la scarsa qualità dell'acqua e dell'aria."
In che modo la razza può avere un impatto sulla pressione alta?,"Alcuni gruppi etnici possono essere più predisposti all'ipertensione a causa di una combinazione di fattori genetici, ambientali e di stile di vita. Ad esempio, le persone di origine afroamericana hanno una prevalenza più alta di ipertensione e possono svilupparla più precocemente nella vita rispetto ad altri gruppi."
In che modo l'ipertensione può essere influenzata dalla razza?,"L'ipertensione può essere influenzata dalla razza a causa di differenze genetiche, socio-economiche e accesso alle cure sanitarie, che possono aumentare il rischio per alcune popolazioni."
In che modo l'appartenenza etnica può incidere sull'ipertensione?,"L'appartenenza etnica può influenzare l'ipertensione a causa di una combinazione di fattori genetici, alimentari, socioeconomici e accesso alle cure mediche."
