Sentence,Response
Qual è la posizione migliore per misurare la pressione arteriosa?,"Siediti con i piedi appoggiati a terra e la schiena dritta, assicurandoti che il braccio sia all'altezza del cuore. Il braccio deve essere sostenuto su una superficie piana."
Quali errori devo evitare per assicurarmi una lettura accurata della pressione?,"Evita di parlare, muovere il braccio o incrociare le gambe durante la misurazione. Assicurati che il bracciale sia della misura corretta e posizionato saldamente, ma non troppo stretto."
Come posso eseguire una misurazione della pressione corretta a casa?,"Segui le istruzioni del tuo misuratore automatico. Misura la pressione alla stessa ora ogni giorno, siediti in una posizione comoda e prendi due letture consecutive."
Cosa dovrei fare per garantire una misurazione affidabile della pressione sanguigna?,"Controlla regolarmente la precisione del tuo misuratore. Evita caffè e sigarette prima della misurazione, siediti in modo rilassato e utilizza un bracciale della misura giusta."
Qual è il metodo ideale per ottenere risultati precisi dalla misurazione della pressione?,Assicurati di misurare la pressione alla stessa ora ogni giorno e di eseguire almeno due letture consecutive. Evita attività fisica e sostanze stimolanti prima della misurazione.
Quali sono i consigli più utili per avere una corretta misurazione della pressione?,"Siediti rilassato con il braccio all'altezza del cuore, utilizza un misuratore automatico con un bracciale della misura corretta e mantieni una routine di misurazione regolare."
"Vorrei gestire anche oggi la mia ipertensione.,","Mantieni una routine di esercizio fisico moderato, segui una dieta povera di sale e misurati la pressione regolarmente. Segui le istruzioni del medico sui farmaci e sullo stile di vita."
Come posso assicurarmi di tenere sotto controllo la mia pressione alta oggi?,"Prendi i tuoi farmaci come prescritto, monitora la tua pressione a casa e adotta misure per ridurre lo stress. Segui una dieta sana ed evita il sale in eccesso."
Cosa posso fare oggi per mantenere i miei valori pressori stabili?,"Evita caffeina, fumo e alcol, e fai attività fisica moderata come una passeggiata. Assicurati di dormire a sufficienza e di seguire una dieta povera di sale."
